{
    "$schema": "http://json-schema.org/schema#",
    "type": "object",
    "properties": {
        "status": {
            "type": "string"
        },
        "parameters": {
            "type": "object",
            "properties": {
                "align": {
                    "type": "string"
                },
                "seq": {
                    "type": "string"
                }
            },
            "required": [
                "align",
                "seq"
            ]
        },
        "jobtype": {
            "type": "string"
        },
        "list_id": {
            "type": "string"
        }
    },
    "required": [
        "jobtype",
        "list_id",
        "parameters",
        "status"
    ]
}
